{
  "fixtureName": "v1-runtime-config-demo",
  "fixtureVersion": "2026-06-27.v1",
  "owner": "control-plane-runtime-policy",
  "producer": "jaehyeok",
  "consumers": [
    "gateway-data-plane-governance",
    "ai-safety-evaluation-lab",
    "observability-performance"
  ],
  "sourceOfTruth": [
    "docs/archive/v1.0.0/contracts.md",
    "docs/archive/v1.0.0/implementation-plan.md",
    "docs/archive/v1.0.0/schemas/runtime-config.schema.json"
  ],
  "notes": [
    "Gateway reads runtimeConfig through RuntimeConfigProvider.",
    "No plaintext API Key, App Token, Provider Key, Authorization header, raw prompt, or raw response is included.",
    "Hash values are stable symbolic fixture values, not real digest outputs."
  ],
  "runtimeConfig": {
    "schemaVersion": "gatelm.active-runtime-config.v1",
    "configVersion": "runtime_config_v1_demo_001",
    "configHash": "hash_runtime_config_v1_demo",
    "configHashAlgorithm": "sha256(canonical_json(runtimeConfig_without_configHash))",
    "generatedAt": "2026-06-27T02:00:00.000Z",
    "effectiveAt": "2026-06-27T02:00:00.000Z",
    "publishedAt": "2026-06-27T02:00:00.000Z",
    "publishState": "active",
    "tenantId": "tenant_demo_acme",
    "tenantStatus": "active",
    "projectId": "project_customer_support",
    "projectStatus": "active",
    "applicationId": "app_customer_demo",
    "applicationStatus": "active",
    "apiKeyId": "api_key_demo_primary",
    "apiKeyStatus": "active",
    "appTokenId": "app_token_demo_customer_app",
    "appTokenStatus": "active",
    "apiKey": {
      "id": "api_key_demo_primary",
      "type": "api_key",
      "status": "active",
      "prefix": "gsk_live_",
      "last4": "9xA1",
      "scopes": ["chat:completions", "models:read"],
      "expiresAt": null,
      "verification": "prefix_then_hash_compare"
    },
    "appToken": {
      "id": "app_token_demo_customer_app",
      "type": "app_token",
      "status": "active",
      "prefix": "gat_app_",
      "last4": "4tK2",
      "scopes": ["gateway:invoke"],
      "expiresAt": null,
      "verification": "prefix_then_hash_compare"
    },
    "providers": [
      {
        "providerId": "provider_mock_primary",
        "provider": "mock",
        "displayName": "Mock Provider",
        "status": "active",
        "baseUrl": "http://mock-provider:4010",
        "timeoutMs": 30000,
        "secretRef": null,
        "credentialPreview": null,
        "resolver": "none",
        "models": ["mock-fast", "mock-balanced"],
        "failureMode": "fail_closed"
      }
    ],
    "models": [
      {
        "provider": "mock",
        "model": "mock-fast",
        "displayName": "Mock Fast",
        "status": "active",
        "contextWindowTokens": 8192,
        "supportsStreaming": false,
        "supportsJsonMode": false
      },
      {
        "provider": "mock",
        "model": "mock-balanced",
        "displayName": "Mock Balanced",
        "status": "active",
        "contextWindowTokens": 8192,
        "supportsStreaming": false,
        "supportsJsonMode": false
      }
    ],
    "defaultProvider": "mock",
    "defaultModel": "mock-balanced",
    "lowCostProvider": "mock",
    "lowCostModel": "mock-fast",
    "fallbackProvider": "mock",
    "fallbackModel": "mock-balanced",
    "rateLimit": {
      "enabled": true,
      "scope": "application",
      "algorithm": "fixed_window",
      "windowSeconds": 60,
      "limit": 60
    },
    "safetyPolicy": {
      "mode": "rule_based",
      "securityPolicyHash": "hash_security_policy_v1_demo",
      "remoteSafety": {
        "enabled": false,
        "mode": "disabled"
      },
      "detectors": [
        {
          "type": "email",
          "enabled": true,
          "action": "redact",
          "placeholder": "[EMAIL_REDACTED]"
        },
        {
          "type": "phone_number",
          "enabled": true,
          "action": "redact",
          "placeholder": "[PHONE_NUMBER_REDACTED]"
        },
        {
          "type": "resident_registration_number",
          "enabled": true,
          "action": "block",
          "placeholder": "[RESIDENT_REGISTRATION_NUMBER_REDACTED]"
        },
        {
          "type": "api_key",
          "enabled": true,
          "action": "block",
          "placeholder": "[API_KEY_REDACTED]"
        },
        {
          "type": "authorization_header",
          "enabled": true,
          "action": "block",
          "placeholder": "[AUTHORIZATION_HEADER_REDACTED]"
        },
        {
          "type": "jwt",
          "enabled": true,
          "action": "block",
          "placeholder": "[JWT_REDACTED]"
        },
        {
          "type": "private_key",
          "enabled": true,
          "action": "block",
          "placeholder": "[SECRET_REDACTED]"
        }
      ]
    },
    "cachePolicy": {
      "enabled": true,
      "type": "exact",
      "ttlSeconds": 3600
    },
    "routingPolicy": {
      "type": "simple",
      "autoModel": "auto",
      "defaultProvider": "mock",
      "defaultModel": "mock-balanced",
      "lowCostProvider": "mock",
      "lowCostModel": "mock-fast",
      "fallbackProvider": "mock",
      "fallbackModel": "mock-balanced",
      "shortPromptMaxChars": 500,
      "routingPolicyHash": "hash_routing_policy_v1_demo"
    },
    "pricingRules": [
      {
        "pricingRuleId": "price_mock_fast_v1",
        "provider": "mock",
        "model": "mock-fast",
        "pricingVersion": "2026-06-27.mock.v1",
        "currency": "USD",
        "unit": "token",
        "promptTokenMicroUsd": 1,
        "completionTokenMicroUsd": 2,
        "effectiveAt": "2026-06-27T02:00:00.000Z"
      },
      {
        "pricingRuleId": "price_mock_balanced_v1",
        "provider": "mock",
        "model": "mock-balanced",
        "pricingVersion": "2026-06-27.mock.v1",
        "currency": "USD",
        "unit": "token",
        "promptTokenMicroUsd": 2,
        "completionTokenMicroUsd": 3,
        "effectiveAt": "2026-06-27T02:00:00.000Z"
      }
    ],
    "hashing": {
      "canonicalJson": "utf8_json_sorted_keys_no_extra_whitespace",
      "usesSecret": false,
      "configHashSourceFields": [
        "tenantId",
        "projectId",
        "applicationId",
        "providers",
        "models",
        "rateLimit",
        "safetyPolicy",
        "cachePolicy",
        "routingPolicy",
        "pricingRules"
      ],
      "routingPolicyHashSourceFields": ["routingPolicy"],
      "securityPolicyHashSourceFields": ["safetyPolicy.mode", "safetyPolicy.detectors"],
      "requestBodyHash": "sha256(canonical_json(openai_request_body_without_credentials))",
      "promptHash": "sha256(normalized_redacted_prompt_utf8)",
      "cacheKeyHash": "sha256(canonical_json(cache_key_material))",
      "cacheKeyFields": [
        "tenantId",
        "projectId",
        "applicationId",
        "selectedProvider",
        "selectedModel",
        "normalizedRedactedPrompt",
        "securityPolicyHash",
        "routingPolicyHash"
      ]
    },
    "costing": {
      "unit": "micro_usd",
      "formula": "ceil(promptTokens * promptTokenMicroUsd + completionTokens * completionTokenMicroUsd)",
      "savedCostMicroUsdFormula": "sourceRequestCostMicroUsd_on_exact_cache_hit_else_0",
      "usdStringFormat": "fixed_6_decimal_places",
      "missingPricingRule": "provider_error"
    }
  }
}
